<?xml version="1.0" encoding="UTF-8"?>
<!DOCTYPE SONG SYSTEM "song.dtd">
<SONG id="2">
  <TITLE>ADSFS</TITLE>
  <COMPOSER>adf</COMPOSER>
  <PRODUCER>asdf</PRODUCER>
  <PUBLISHER>asdf</PUBLISHER>
  <LENGTH>asdf</LENGTH>
  <YEAR>asdf</YEAR>
  <ARTIST>adf</ARTIST>
</SONG>
